Question,Answer
American Water Works Co Inc (AWK US Equity)   Okay. And are you able to get – expand this customer base out of these cities where you actually provide your regulated services?,"Well, when we have exclusive partnership, for example in our Homeowner Services we oﬀer it to our existing customers in several of our states, most of our states and of course they know us and we put it on our bill. Where we have exclusive partnerships speciﬁcally New York City and Nashville and we're able to actually put it on bill with the water bill, we tend to see higher take rates."
Okay. Thank you for the color.,And renewal.
And one last quick – I'm sorry. Go ahead.,"And renewal, both take rates and renewal rates."
Okay. Thank you for the color. One last quick question in continuation of the information on the Rex and XTO Energy contracts. Where exactly do you report them? Is that in the industrials or the commercials?,It's actually in our regulated segment and it's in industrial.
Okay. And how big are these contracts and what's the scope of increasing your energy exposure?,"I think we have reported that last year I believe we sold about $3 million or $3.2 million, $4 million, $3.2 million I think in revenues last year at the regulated on the shale.   American Water Works Co Inc (AWK US Equity)      Yeah, and this year it's growing strongly. But from a risk perspective keep in mind that the capital that we spend and the investments when it's done on the regulatory side, they're automatically rolled in the rates. So we're not really taking what I would call a capital risk. And the Commission is willing to do that because we're bringing water to areas that don't currently have it and so they view as a very positive development, economic development opportunity for those communities."
"Okay, great. Thank you for the color and congratulations guys.  Operator  Thank you. And I'm showing no further questions. I'll turn the call back to management.","Okay. Well, I wanted to thank you all again. And I know that you will give Susan and the team the same kind of sharp look and opportunities that you have over the last four years, and I thank you very much.     Wait. Before you're oﬀ the line, Jeﬀ – given that this is Jeﬀ's last call, I just want to take a few minutes to recognize him. Now Jeﬀ does not know that I am doing so I'm glad that you can't see the look that he's giving me right now as he sits to my right. I do want to just mention we have a slide we want to pull up.  American Water has achieved some extraordinary things during Jeﬀ's tenure as President and CEO. In terms of ﬁnancial performance, American Water has grown its market capitalization from less $4 billion to more than $8 billion without an equity issuance. We've strengthened our balance sheet with increases in revenue, net margin and cash ﬂow. We've garnered credit ratings increases from both agencies. We achieved our stretch O&M eﬃciency ratio goal two years early, and both our regulated and market-based businesses have seen impressive growth.  In fact if you have been a shareholder, which you should have, since Jeﬀ joined us back in 2007, you have enjoyed an almost 130% total shareholder return. That has led to a dividend increase year-over-year and today we are one of the leaders in dividend growth. Not too shabby for less than four years' work.  But that's just part of what Jeﬀ is done here at the company from taking the lead in raising the value of water idea on a national basis to shepherding American Water to become the ﬁrst U.S. water provider on the Dow Jones sustainability index, to creating a culture of continuous improvement. There just aren't many CEOs who have accomplished so much and especially in   American Water Works Co Inc (AWK US Equity)   such a short time. And he's done it in a way that leaves a lasting legacy for us to continue to build upon.  Some of you know Jeﬀ hates to wear a coat and tie. He is much more comfortable in blue jeans riding horses, so right now we tip our hats to him, our leader, our mentor and our friend. And we wish him the best as he rides oﬀ to enjoy the new challenges his future brings. And now we're done.  Operator  Ladies and gentlemen, this concludes our conference. Thank you for your participation. You may now disconnect.  This transcript may not be 100 percent accurate and may contain misspellings and other inaccuracies. This transcript is provided ""as is"", without express or implied warranties of any kind. Bloomberg retains all rights to this transcript and provides it solely for your personal, non- commercial use. Bloomberg, its suppliers and third-party agents shall have no liability for errors in this transcript or for lost proﬁts, losses, or direct, indirect, incidental, consequential, special or punitive damages in connection with the furnishing, performance or use of such transcript. Neither the information nor any opinion expressed in this transcript constitutes a solicitation of the purchase or sale of securities or commodities. Any opinion expressed in the transcript does not necessarily reﬂect the views of Bloomberg LP. © COPYRIGHT 2024, BLOOMBERG LP. All rights reserved. Any reproduction, redistribution or retransmission is expressly prohibited."
