Question,Answer
"First of all congratulations. Because over the last two to three years, Nick, Brian (inaudible) management team have done a very, very good job of transforming AEP. I have one or two questions though just in terms of how you're trying to think strategically about both the non- regulated business and the regulated business. I'll start on the non-reg. And when you look at the portfolio and the size of the retail book, what you don't have is a lot of scale or diversity, meaning you don't have a ton of asset diversity, you have almost no regional diversiﬁcation on the non-regulated side. And your retail business while growing is small relative to the industry.  And I'm just curious, any of the McKinsey [ph] guys running around your building at some point would probably hate to hear me use this reference. But if you had to plot your non-reg -- related business or consulting major cashcow or harvest or I think it was star for the growth businesses, how would you kind of think about that business strategically, long-term and your intend for it?","Well, Michael, I've stated previously that we are regulated company and we're focused on being a regulated company, if we can make this comparative business look towards our regulated with the hedging associated with it, then that certainly help us focus on what we do with that business going forward.  And keep in mind too, that the ﬂeet that's you're talking about is one of the larger unregulated ﬂeets in the country will be 9,000 megawatts, it is centrally located within the area of PJM area, but it also, as you know, two thirds coal, one thirds gas, two thirds with fully controlled units that are well within the mining a third natural gas, which is going to be at -- probably at the market price. So, we see -- I mean we see this business, particularly if you look at it in its breadth, not just the matter of the generation margins and sales. On the retail side, we're focused on hedging that generation, focused on not megawatt hours, but margins and we're focused on the wholesale activity that we've been doing for years to be complimentary.   American Electric Power Co Inc (AEP US Equity)   So the has a total package, but I think even if you look at the generation assets from sales, they are competitive in the market. So, I don't care if I have 50,000 megawatts in a market that I'm competitive or 2000. So it really is a matter of where these units stack up in the marketplace and they stack up well.  And then secondly, how you're complementing that business and what your focus is. If we wind up with a competitive business that looks like something our shareholders are interested in but doesn't provide the volatility that makes us look like a regulated utility. And that's ﬁne. But, we'll have to get there and see where it takes us."
"Okay. On the regulated side, when you look across your service territory and you've done a good job of positioning the transmission side of the business to grow and kind of we all know that transmission has its challenges just in terms of the timeline of growth, but that's a more of a national issue, not company speciﬁc. But when you look at distribution and you look at generation, how do you think about where over the next 5 to 7 years your greatest rate base growth opportunities lie?","Well, I think the grace rate base opportunities are in transmission and distribution, because if you believe that you're being into an area where we have generation. But we're also taking a broader view of what resources are, which includes transmission from an optimization standpoint includes renewables, includes smart grid technology type applications.  I think we're in a pretty good position, because we don't have any real large central station generation activities going on. And we are advancing transmission and distribution. The infrastructure requirements associated with that are tremendous in this industry and it gives us a distinct opportunity to continue to invest to ensure the service reliability of our customers.  So we have -- we have a real opportunity here that not be and I guess, it goes to my earlier conversation to not be all of our focus of our customers working on backing on activities, like a massive amount of environmental spending, a massive amount of a new generation that's very, I'd say the density level is pretty high. So from a capital standpoint, we have the opportunity to put capital where it will make the most beneﬁcial eﬀect for our customers and as well our shareholders. So, we are trying to move as much as we can to transmission and the distribution side infrastructure."
"Got it. Thank you, Nick. Much appreciated.","Yeah. And also I would add to that from a regulated standpoint, we do have a large amount of our service territory that still regulated from a generation perspective. So we'll continue to invest in those facilities as well.   American Electric Power Co Inc (AEP US Equity)   Operator  And our next question is from the line of Ali Agha with SunTrust. Please go ahead."
Thank you. Good morning.,"Hi, Ali."
"First question on the Ohio customer switching. Is that currently on track with how you budgeted that and what's in the ESP order. And also related to that, I think for the year, your budget had the gross margins for Ohio utilities down but through the ﬁrst quarter you're ﬂat. So should we assume that Ohio is doing better than planned and it is a best out of it?","Yeah, we're largely on track with the agreement, I think 53% of our customer loan switch another 3% in the queue, so it's moving along at a steady pace and we see that continuing. So I'd say that we're largely on pace and moving forward."
"And it includes the overall earnings contribution as well, you think that's still on budget as well?",Yeah. Yeah.
"Okay. A separate question on -- after this SWEPCo Texas rate cases down, can you remind us what would be the next big rate case coming up for you guys?","Well, as a result of the legislation in Indiana, that gives us a distinct opportunity to focus there on achieving better results -- rate related to the regulatory lag. So it gives us an opportunity to do that and I think Virginia has also an opportunity for us as we complete the corporate separation and move forward with that kind of activity. So, I'd say, those are the two jurisdictions and then we continue to look at other areas as well. But I'd say those are probably the two larger ones and keep in mind we are making a very large investment in R&D associated with the   American Electric Power Co Inc (AEP US Equity)   nuclear long cycle management process, it's $1.2 billion, $1.3 billion and that's largely in process of being recovered. So there are some areas of spending that will be -- that we'll be doing. But I'd say that the stage is set."
"Understood. And last question, I recalled the past Brian or Nick you guys have said in the context of the 4% to 6% annual EPS growth that you've been targeting that through this transition period in Ohio, I guess through '12 to '15 period more likely the lower end and the high-end with that more sense, is that still the way to thinking about this?","No, I don't think we said that. We're anticipating the 4% to 6% of the 2013 base. So the full range of the range that we talked about is in place even during the transition period."
Of the '13 base and Brian -- over -- is that a ﬁve year look forward or how should we think about that?,Just until further notice.
Until further notice. Thank you.,"Thanks.  Operator  And at this time, there are no other questions, please continue.     Well, thank you for joining us for today's call. And as always, the IR team is available to answer your any additional questions that you may have. And Trisha, can you give the replay information.  Operator  Certainly. Ladies and gentlemen, today's conference will be made available for replay after 11 A.M. Eastern Time today until May 3rd at mid night. You may access AT&T Executive playback   American Electric Power Co Inc (AEP US Equity)   service at any time by dialing 1-800-475-6701 and entering the access code 287270. International participants may dial 1-320-365-3844. That does conclude your conference for today. Thank you for your participation and for using AT&T Executive TeleConference service. You may now disconnect.  This transcript may not be 100 percent accurate and may contain misspellings and other inaccuracies. This transcript is provided ""as is"", without express or implied warranties of any kind. Bloomberg retains all rights to this transcript and provides it solely for your personal, non- commercial use. Bloomberg, its suppliers and third-party agents shall have no liability for errors in this transcript or for lost proﬁts, losses, or direct, indirect, incidental, consequential, special or punitive damages in connection with the furnishing, performance or use of such transcript. Neither the information nor any opinion expressed in this transcript constitutes a solicitation of the purchase or sale of securities or commodities. Any opinion expressed in the transcript does not necessarily reﬂect the views of Bloomberg LP. © COPYRIGHT 2024, BLOOMBERG LP. All rights reserved. Any reproduction, redistribution or retransmission is expressly prohibited."
