Question,Answer
Okay. And the other question was on Illinois. As we have seen the 30-year treasury go up why is that not impacting your expected earnings from the business or is it too small to have much of an impact?,"Ameren Corp (AEE US Equity)   Yes. It is embedded in there so you know we have seen the 30-year treasuries rise this year, but it is having, it is up I guess about 30 basis points from where we started, our guidance at the beginning of the year, and 30 basis points for this year is about $0.015 That is embedded in the overall guidance. You know, if you look at the guidance we've provided and think somebody did this last time, took our $2.00 to $2.15 range and added back the parent and other of $0.20 to get to a midpoint of a range around our regulated earnings, which gets you it about $2.27 or $2.28, somewhere in that range. We started the year with regulated earnings expectations of $2.25. After the First Quarter we raised it to a midpoint of about $2.30. Again there is a range around these numbers. You know we didn't have anything speciﬁcally and therefore the $0.06 FAC charge frankly as Warner said earlier could have gone either way. A $0.06 charge or a $0.04 upside. The fact that we had the $0.06 charge is the reason we're bringing down the upper end of our range from $2.20 to $2.15. My point is that we brought down that midpoint only $0.02 or $0.03 based on that charge. We're seeing a little bit of upside from the 30-year treasuries and we're also controlling our costs to help oﬀset some of that. Bottom line it's steady as she goes in terms of our regulated earnings this year. We've been between that $2.25 and $2.30 midpoint. We're still there, even after the FAC charge, about that $2.27 or $2.28 range. Those are some of the things incorporating. We had a refueling outage in the Second Quarter. Result of that as we shared in our talking points, it was $0.08 for the quarter, $0.09 for the year - - right in line with the guidance we provided earlier in the year. So all in all things are in line through six months."
"Just another follow up question on Illinois. In terms of the new legislation there, it seems like it didn't have much of an impact on your numbers. Can you just talk about why that is? I was under the impression that it will improve at the delta between earned and allowed going forward.","Yes, you're asking about the Illinois Electric in particular?"
"Yes, sorry.","The reason it didn't have a really big impact on this year, is that it will have a positive impact going forward. So Tom went through some of the things that are underscored -- which is use of the year-end rate base, the actual year-end cap structure as well as in weighted average cost or capital returns on deferral's. One of the things in our talking points we did talk about is that coming out of the ﬁrst year of the use of the legislation, there is actually a deferral that is actually a liability back to the customers. And so when you look at the weighted average cost of capital return on that, you know that is actually an incremental obligation which mitigates the positive impact of the other two items, the year-end rate base and the actual cap structure. For the year, it was a bit of a neutral. As we go through time -- and this was in our talking points -- as we go through time and we deploy the capital in order to improve the infrastructure to create the jobs per the act we expect those deferral's to be actually regulatory assets and would   Ameren Corp (AEE US Equity)   expect them to the weighted average cost to capital returns on those. So this year, it kind of netted out to not really having much of an impact but going forward, those ﬁxes to the legislature are necessary and will be positive overall."
Great. Thanks. Sorry I missed that in your talking points.,No problem.  Operator  Our next question comes from the line of Ashar Khan with Visium Asset Management.
"My question has been answered. Thank you, so much.",Thank you.  Operator  Michael Lapides with Goldman Sachs.
"Coming back to Ameren Illinois real quick, I want to make sure I understand we have seen this with Commonwealth Edison. What is the amount of -- on the electric side of items, costs that the commission does not include in the formula rate process, meaning that creates a little bit of structure earnings, structural under earning. I don't think it's a huge number, but when you think about kind of going forward 2014, 2015 and beyond.","Michael, I wish I had that in front of me. We went through some of this, actually coming out of our year-end call and perhaps Doug can ﬁnd the slide. Coming out of year-end we gave our guidance for this year we actually laid out some of the items that actually we expected to cause some under earning this year. Actually Doug was able to pull it out. The things we laid out at that time, Michael were about $8 million of ICC rate making adjustments. You know, those are things that unless we are able to ﬁnd some other way to mitigate those or to get recovery those would be sort of recurring. We laid out -- this was in slide 13 by the way -- in the year-end call, we had about $7 million of electric system rework that we planned to do and are doing this year. And that would not be recoverable. However, while those costs were incurred this year   Ameren Corp (AEE US Equity)   and last year, we don't expect that those costs would be sort of going forward costs. We believe that, that rework is largely behind us after this year. So would not expect that to continue to be a driver of under earning. And then the $1 million we had this year it was greater last year. We had $1 million this year of required donations under the formula rates. Of course we continue to make those donations going forward and those are non-recoverable. I think we laid out there was about $60 million or so of items impacting us this year, but with the expectation that, that would go down to maybe in the $9 million range next year. So that's sort of the guidance we have provided."
"Got it. When investors think longer-term about Illinois Electric business should they basically think -- look on the distribution or delivery side, you are likely to, there is nothing structure that keeps rate based math from happening meaning taking an end of year rate base multiplying whatever the equity layer is and then just taking 30-year treasury plus 580 BIPS and then maybe subtracting out those non-recoverable items.","Yes, Michael, that's right. You know as you look forward it should work obviously as we got started last year with these reviews, there were certainly some debate around some of these historical ICC rate making adjustments or how the law would be implemented. You know those historical ICC rate making adjustments will continue per the law. We believe we've gotten clarity from the legislature in terms of some of the issues that were debated with the ICC. But generally, you are right Michael. We should have rate based growth going forward. The rate making should work from likely as designed and as a 30-year treasuries, if they do rise, then that will impact the overall return. I think next year, that blue chip consensus forecast we use right now is 3.95 which would apply for next year if that held true, a 9.75 return in the Illinois Energy delivery base."
"Got it. Thank you, Marty. Much appreciated.","You're welcome.  Operator  Mr. Fischer, we have no further questions at this time. I would now like to turn the ﬂoor back over to you for closing comments.     Thank you. Thank you for participating in this call. Excuse me. Let me remind you again that this call is available for one year on our website. You may also call the contacts listed on the release, ﬁnancial analyst inquiries should be directed to me, Doug Fischer, or my associate Matt Thayer.   Ameren Corp (AEE US Equity)   Media should call Joe Mullencamp. Contact numbers are on the news release. Again, thank you for your interest in Ameren and have a good day.  Operator  Ladies and gentlemen this does conclude today's teleconference. You may disconnect your lines at this time. Thank you for your participation and have a wonderful day.  This transcript may not be 100 percent accurate and may contain misspellings and other inaccuracies. This transcript is provided ""as is"", without express or implied warranties of any kind. Bloomberg retains all rights to this transcript and provides it solely for your personal, non- commercial use. Bloomberg, its suppliers and third-party agents shall have no liability for errors in this transcript or for lost proﬁts, losses, or direct, indirect, incidental, consequential, special or punitive damages in connection with the furnishing, performance or use of such transcript. Neither the information nor any opinion expressed in this transcript constitutes a solicitation of the purchase or sale of securities or commodities. Any opinion expressed in the transcript does not necessarily reﬂect the views of Bloomberg LP. © COPYRIGHT 2024, BLOOMBERG LP. All rights reserved. Any reproduction, redistribution or retransmission is expressly prohibited."
