Question,Answer
How you guys doing?,"Good.     Well.     Yes, sir."
"Duke Energy Corp (DUK US Equity)   You're one of the best ever, even though you never won that award, okay. I just want to say that. I would have given you that award.","You just gave it to us, so thank you."
"Okay. But maybe next year Michael will win it, so. Actually I think most of my questions have been answered, but just back on the sales. So leap year is what, about 30 basis points on an annual basis, is that?","That's roughly right, Andy."
"Right, so I guess for the quarter, you times up by four or something like that, or is that not the right math?","Yeah I think you could get in the ballpark there, and it's a little, that's a rough way to do it."
Right.,"But again, I think getting weather normalized data is as much art as science and when you get an extreme period like we had in March and comparing it to an extreme period like a prior year, I think you can get ﬂuctuations that make that comparison a little distorted. We think our customer growth and volumes are in line with our broad prediction levels and we'll keep an eye on it."
"What do you guys think, I mean just in general, because it's not just you who are seeing like decent customer growth or weak sales trends and it's not just this quarter. Is it still energy eﬃciency or what else could it be?","Duke Energy Corp (DUK US Equity)   The other thing that we look at, Andy, is multifamily housing versus single family homes. We're starting to see some positive trends in the Carolinas where there are more single family home construction opportunities. But coming out of the economic downturn, a lot of the growth was in multifamily units, which by their footprint use less energy than a home. So, I think we're closely monitoring this and the call to the action for us is to ensure that our cost structure and the way we manage our investments and assets are consistent with the trends we're seeing at the top line. And we believe we have a demonstrated track record in managing our business that way."
"Yeah. And then, just in general I guess, international is doing better than expected. Part of that is the tax beneﬁt; part of that is hydro and then I would assume for the second half of the year, you'll have some tailwind from currency if things kind of stay where they are. So that's a positive for this year. But it also seems that the utility itself, because of the sales trends and I guess lack of rate increases, seems to be towards the low end of your range at this point. Again, it's early in the year, but is that a fair statement?","Andy, we're on target for the range of $450 million to $470 million that we talked to you about. This is the ﬁrst quarter. I think to give you any more speciﬁcs on placement within the guidance range is just premature. As you know, the third quarter is our most signiﬁcant quarter, and we're managing the business with identifying rate increase opportunities. Steve talked about South Carolina of course watching costs as part of that. And we'd like to see a longer trend on the sales growth to continue to monitor where that is progressing. So on track to achieve what we set out to achieve at the beginning of the year."
"Okay. Thank you very much, and Bill, again congratulations. I think you'll be a great Controller and keep everyone in the straight and narrow, because I guess that's what a Controller does, and I'm sure your kids will be happy to spend more time with you than they have for the last few years.","All right.     Thanks, Andy.     Thank you, Andy."
Duke Energy Corp (DUK US Equity)   Yes.,"Okay.  Operator  With that being our last question, I'll turn the call back to Lynn Good for closing comments.     Okay, Yolanda, thank you. And thanks everyone for hanging in with our ﬁre alarm and our farewell to Bill Currens and welcome to Mike Callahan today. And most of all, thank you for your interest and investment in Duke. We look forward to meeting with many of you over the next several weeks and months and look forward to continue discussions. So, thanks again.  Operator  That will conclude today's conference. Thank you all once again for your participation.  This transcript may not be 100 percent accurate and may contain misspellings and other inaccuracies. This transcript is provided ""as is"", without express or implied warranties of any kind. Bloomberg retains all rights to this transcript and provides it solely for your personal, non- commercial use. Bloomberg, its suppliers and third-party agents shall have no liability for errors in this transcript or for lost proﬁts, losses, or direct, indirect, incidental, consequential, special or punitive damages in connection with the furnishing, performance or use of such transcript. Neither the information nor any opinion expressed in this transcript constitutes a solicitation of the purchase or sale of securities or commodities. Any opinion expressed in the transcript does not necessarily reﬂect the views of Bloomberg LP. © COPYRIGHT 2024, BLOOMBERG LP. All rights reserved. Any reproduction, redistribution or retransmission is expressly prohibited."
