Question,Answer
"So, I wanted to go back to maybe a little bit to the volume picture. And just looking at the breakdown by the class, right, it seems like industrial is doing pretty well here, right? It's barely down year-over-year in the weather-adjusted basis. And commercial,     understandably, is suﬀering a little more, and the residential is up and I think we will get that.  My question is, I guess, could you help us a little more as in what's going on on the ground right now? Is this a trend we should just expect to continue the same way? And if the -- given the shift in the mix, if the sensitivities to this changes that we had pre-COVID still hold in this new environment?","Yeah. So, Sophie, the industrial piece in particular that you noted, we were expecting pretty solid growth this year at the outset, in the 5% to 6% range for industrial. So, the fact that it's 1% down is a pretty big drop relative. Even though year-over-year it's 1% down, we are expecting to be 5%, 6% up. And on the balance of the year, I would say that we expect the residential to trend -- start to trend down as people return to work in diﬀerent places in their home and we would expect the commercial and governmental to slowly begin to trend up and industrial to hopefully begin to improve. And that's all, I think, consistent with where we lined out our expectations in May. And so, I think that we are continuing to expect the phased reopening to support slow but steady improvement in these numbers."
"All right, thank you. And then lastly, maybe if you could give us a little bit of sneak peek into your Analyst Day? I think things are going on track for the most part for your company. What topics or what areas do you plan to give us an update on?","As far as topics for the Analyst Day, we'll probably just -- A little more depth and color around what's in the capital plan, our trend to lower emissions and as well as continuous improvement structure and things like that will be subjects that we'll talk about. We don't want to talk too much about it today. We want you to tune in."
"All right, thank you.",Thank you.  Operator  Thank you. Our next question comes from the line of Ryan Levine from Citi. Your line is now open.
Good morning.,"Good morning, Ryan."
"What projects are in your capital plan that are most sensitive to load outlook that was incorporated within that 10%, that was highlighted in the prepared remarks?","There probably is smattering. Obviously, there is -- the new customer hookups are the big piece of it in the distribution of the transmission space. So for example, if you had a major industrial customer that was located in your service territory, the substations for them can be pretty signiﬁcant. So, you'd have to build in the substation. And then we just have general line extensions to our distribution business every day, when a new house is built or something like that.  So, some of the transmission infrastructure could be put in that bucket as well to the extent that we need to put transmission infrastructure into an area because of either prior load growth or new load growth, but it's really more in getting into that last mile."
"Thanks. And then in terms of the industrial load assumption in your guidance, what are your conversations with customers suggesting for that outlook and are there any big lumpy customers that you have color as to their plans or timing of when some of that industrial load can return throughout the remaining portion of the year?","Hey, Ryan. It's Rod. I know we will talk more in detail about the nuances of our industrial engagement perhaps at Analyst Day, but part of our conﬁdence comes from -- and our growth observations comes from the fact that we're actually talking to real customers and we can quantify and identify the existing projects. And so what we are paying attention to at the moment are not just sort of the macroeconomic commodity spreads and other indicators. We're talking to those companies who have made ﬁnal investment decisions and whether they've delayed projects or ramping back up, we can point to speciﬁc companies and tie them to speciﬁc projects that are in our outlook.  And as we've shared before, we probably await not just the projects in the plan, but there are other projects that make up our economic development type of pipeline. And that are -- we're also monitoring to determine whether or not we need to include those or exclude those as the case may be in the plan.  We've not seen much movement in our existing plan with regard to projects that we've identiﬁed that, for instance, that were canceled. There might have been one or two here and there, but they were on the lower end of the spectrum in terms of     impact, but our conﬁdence comes from the fact that we are tying them to actual project that is still in play."
"Okay, thank you.    Operator  Thank you. Our last question comes from the line of Durgesh Chopra from Evercore ISI. Your line is now open.",
"Okay. Close to good afternoon, guys. Thanks for sneaking me here. I just want to quickly clarify, Drew, the $0.15 to $0.20. I'm trying to reconcile that to the Slide 26 where you showed the rate base exposure. Is it -- Am I right in thinking about the $0.15, $0.20 as essentially you sort of, in a worst-case scenario, losing the return on that 400 -- north of $400 million rate base? Is that the right way to think about it, or am I comparing apples and oranges?","Yeah. So, the $400 million plus the $100 million of interest that is part of the refund, because they are saying that we owe the money. And it's not actually really rate base. It's refund. So, the rate base doesn't really change in that regard. It would only change if we were successful in our outcome with the IRS, because then there would be a deferred tax and the rate base would go down -- the net rate base will go down. So, really what we're talking about is the $510 million that you see there. That total amount is the requested refund. And so, we've had to ﬁnance that and then the lease payments that are above the $17 million a year on an ongoing basis."
Understood. Thank you. Thanks a lot.,"Thank you.  Operator  Thank you. At this time, I'm showing no further questions. I would like to turn the call back over to David Borde for closing remarks.    Thank you, Gigi, and thank you to everyone for participating this morning. Our annual report on Form 10-Q is due to the SEC on August 10th and provides more details and disclosures about our ﬁnancial statements. Events that occur prior to the date of our 10-Q ﬁling that provide additional evidence of conditions that existed at     the date of the balance sheet would be reﬂected in our ﬁnancial statements in accordance with Generally Accepted Accounting Principles.  Also, as a reminder, we maintain a web page as part of Entergy's Investor Relations website called Regulatory and Other Information, which provides key updates of regulatory proceedings and important milestones on our strategic execution. While some of this information may be considered material information, you should not rely exclusively on this page for all relevant company information.  And this concludes our call. Thank you very much.  Operator  Gentlemen, this concludes today's conference call. Thank you for participating. You may now disconnect.  This transcript may not be 100 percent accurate and may contain misspellings and other inaccuracies. This transcript is provided ""as is"", without express or implied warranties of any kind. Bloomberg retains all rights to this transcript and provides it solely for your personal, non-commercial use. Bloomberg, its suppliers and third- party agents shall have no liability for errors in this transcript or for lost proﬁts, losses, or direct, indirect, incidental, consequential, special or punitive damages in connection with the furnishing, performance or use of such transcript. Neither the information nor any opinion expressed in this transcript constitutes a solicitation of the purchase or sale of securities or commodities. Any opinion expressed in the transcript does not necessarily reﬂect the views of Bloomberg LP. © COPYRIGHT 2024, BLOOMBERG LP. All rights reserved. Any reproduction, redistribution or retransmission is expressly prohibited."
